{
  "campaign_id": "rotated-surface-strategy-fixture",
  "candidate_specs": [
    {
      "candidate_id": "strategy-d3-a",
      "code_family": "rotated-surface-code",
      "parameters": {
        "distance": 3,
        "layout": "rotated"
      },
      "provenance": {
        "kind": "fixture",
        "label": "strategy-d3-a"
      }
    },
    {
      "candidate_id": "strategy-d3-b",
      "code_family": "rotated-surface-code",
      "parameters": {
        "distance": 3,
        "layout": "rotated"
      },
      "provenance": {
        "kind": "fixture",
        "label": "strategy-d3-b"
      }
    },
    {
      "candidate_id": "strategy-d5",
      "code_family": "rotated-surface-code",
      "parameters": {
        "distance": 5,
        "layout": "rotated"
      },
      "provenance": {
        "kind": "fixture",
        "label": "strategy-d5"
      }
    },
    {
      "candidate_id": "strategy-d7",
      "code_family": "rotated-surface-code",
      "parameters": {
        "distance": 7,
        "layout": "rotated"
      },
      "provenance": {
        "kind": "fixture",
        "label": "strategy-d7"
      }
    }
  ],
  "mode": "explicit_list",
  "strategy": {
    "name": "adaptive",
    "params": {}
  }
}
